{
  "packFormat": 1,
  "id": "wend.core",
  "version": "1.0.0",
  "label": {
    "en": "Wend Core Nodes",
    "ja": "Wend コアノード"
  },
  "author": "wend",
  "license": "GPL-3.0",
  "requires": {
    "app": ">=0.2.0"
  },
  "nodes": [
    {
      "type": "wend.core.loadLocalFile",
      "label": { "en": "Load Local File", "ja": "ローカルファイル読込" },
      "category": "io",
      "icon": "📂",
      "description": { "en": "Reads a file from disk and puts its content on the blackboard.", "ja": "ディスクからファイルを読み込み、コンテンツをブラックボードに保存します。" },
      "ports": {
        "in": [],
        "out": [
          { "name": "content", "type": "media", "bbDefault": true }
        ]
      },
      "params": [
        {
          "name": "filePath",
          "type": "filepath",
          "required": true,
          "default": "",
          "ui": { "widget": "file", "label": { "en": "File Path", "ja": "ファイルパス" }, "browse": true }
        },
        {
          "name": "outputType",
          "type": "enum",
          "required": false,
          "default": "media",
          "ui": { "widget": "select", "label": { "en": "Output Type", "ja": "出力タイプ" } }
        },
        {
          "name": "outputKey",
          "type": "text",
          "required": true,
          "default": "",
          "ui": { "widget": "bbkey", "label": { "en": "Output Key", "ja": "出力キー" } }
        },
        {
          "name": "outputScope",
          "type": "enum",
          "required": false,
          "default": "run",
          "ui": { "widget": "select", "label": { "en": "Output Scope", "ja": "出力スコープ" } }
        }
      ],
      "impl": { "kind": "builtin", "handler": "loadLocalFile" },
      "compat": {
        "btAction": "loadLocalFile",
        "paramMap": {
          "filePath": "btLocalFilePath",
          "outputKey": "btOutputKey",
          "outputType": "btOutputType",
          "outputScope": "btOutputScope"
        }
      }
    },
    {
      "type": "wend.core.playAudio",
      "label": { "en": "Play Audio", "ja": "オーディオ再生" },
      "category": "media",
      "icon": "🔊",
      "description": { "en": "Plays an audio file stored on the blackboard.", "ja": "ブラックボードに保存されたオーディオを再生します。" },
      "ports": {
        "in": [
          { "name": "audio", "type": "media" }
        ],
        "out": []
      },
      "params": [
        {
          "name": "inputKey",
          "type": "text",
          "required": true,
          "default": "",
          "ui": { "widget": "bbkey", "label": { "en": "Input Key", "ja": "入力キー" } }
        }
      ],
      "impl": { "kind": "builtin", "handler": "playAudio" },
      "compat": {
        "btAction": "playAudio",
        "paramMap": {
          "inputKey": "btInputKey"
        }
      }
    },
    {
      "type": "wend.core.playVideo",
      "label": { "en": "Play Video", "ja": "ビデオ再生" },
      "category": "media",
      "icon": "🎬",
      "description": { "en": "Plays a video file stored on the blackboard.", "ja": "ブラックボードに保存されたビデオを再生します。" },
      "ports": {
        "in": [
          { "name": "video", "type": "media" }
        ],
        "out": []
      },
      "params": [
        {
          "name": "inputKey",
          "type": "text",
          "required": true,
          "default": "",
          "ui": { "widget": "bbkey", "label": { "en": "Input Key", "ja": "入力キー" } }
        }
      ],
      "impl": { "kind": "builtin", "handler": "playVideo" },
      "compat": {
        "btAction": "playVideo",
        "paramMap": {
          "inputKey": "btInputKey"
        }
      }
    },
    {
      "type": "wend.core.pipelineOutput",
      "label": { "en": "Pipeline Output", "ja": "パイプライン出力" },
      "category": "io",
      "icon": "📋",
      "description": { "en": "Sets the final output of the pipeline from the blackboard.", "ja": "ブラックボードからパイプラインの最終出力を設定します。" },
      "ports": {
        "in": [
          { "name": "output", "type": "any" }
        ],
        "out": []
      },
      "params": [
        {
          "name": "inputKey",
          "type": "text",
          "required": true,
          "default": "",
          "ui": { "widget": "bbkey", "label": { "en": "Input Key", "ja": "入力キー" } }
        }
      ],
      "impl": { "kind": "builtin", "handler": "pipelineOutput" },
      "compat": {
        "btAction": "pipelineOutput",
        "paramMap": {
          "inputKey": "btInputKey"
        }
      }
    },
    {
      "type": "wend.core.math",
      "label": { "en": "Math", "ja": "計算" },
      "category": "transform",
      "icon": "🔢",
      "description": { "en": "Evaluates a mathematical expression.", "ja": "数式を評価します。" },
      "ports": {
        "in": [],
        "out": [
          { "name": "result", "type": "number", "bbDefault": true }
        ]
      },
      "params": [
        {
          "name": "expression",
          "type": "text",
          "required": true,
          "default": "",
          "ui": { "widget": "text", "label": { "en": "Expression", "ja": "数式" } }
        },
        {
          "name": "outputKey",
          "type": "text",
          "required": true,
          "default": "",
          "ui": { "widget": "bbkey", "label": { "en": "Output Key", "ja": "出力キー" } }
        },
        {
          "name": "outputType",
          "type": "enum",
          "required": false,
          "default": "text",
          "ui": { "widget": "select", "label": { "en": "Output Type", "ja": "出力タイプ" } }
        },
        {
          "name": "outputScope",
          "type": "enum",
          "required": false,
          "default": "run",
          "ui": { "widget": "select", "label": { "en": "Output Scope", "ja": "出力スコープ" } }
        }
      ],
      "impl": { "kind": "builtin", "handler": "math" },
      "compat": {
        "btAction": "math",
        "paramMap": {
          "expression": "btPrompt",
          "outputKey": "btOutputKey",
          "outputType": "btOutputType",
          "outputScope": "btOutputScope"
        }
      }
    },
    {
      "type": "wend.core.web",
      "label": { "en": "Web Request", "ja": "ウェブ要求" },
      "category": "io",
      "icon": "🌐",
      "description": { "en": "Sends an HTTP request.", "ja": "HTTP要求を送信します。" },
      "ports": {
        "in": [],
        "out": [
          { "name": "response", "type": "text", "bbDefault": true }
        ]
      },
      "params": [
        {
          "name": "request",
          "type": "text",
          "required": true,
          "default": "",
          "ui": { "widget": "textarea", "label": { "en": "URL or Config JSON", "ja": "URLまたは構成JSON" } }
        },
        {
          "name": "outputKey",
          "type": "text",
          "required": true,
          "default": "",
          "ui": { "widget": "bbkey", "label": { "en": "Output Key", "ja": "出力キー" } }
        },
        {
          "name": "outputType",
          "type": "enum",
          "required": false,
          "default": "text",
          "ui": { "widget": "select", "label": { "en": "Output Type", "ja": "出力タイプ" } }
        },
        {
          "name": "outputScope",
          "type": "enum",
          "required": false,
          "default": "run",
          "ui": { "widget": "select", "label": { "en": "Output Scope", "ja": "出力スコープ" } }
        }
      ],
      "impl": { "kind": "builtin", "handler": "web" },
      "compat": {
        "btAction": "web",
        "paramMap": {
          "request": "btPrompt",
          "outputKey": "btOutputKey",
          "outputType": "btOutputType",
          "outputScope": "btOutputScope"
        }
      }
    },
    {
      "type": "wend.core.misc",
      "label": { "en": "Misc Operation", "ja": "その他の操作" },
      "category": "transform",
      "icon": "✍️",
      "description": { "en": "Clipboard copy/paste or writing a static text to blackboard.", "ja": "クリップボードのコピー/貼り付け、または固定テキストのブラックボードへの書き込みを行います。" },
      "ports": {
        "in": [],
        "out": []
      },
      "params": [
        {
          "name": "operation",
          "type": "text",
          "required": true,
          "default": "",
          "ui": { "widget": "text", "label": { "en": "Operation/Text", "ja": "操作/テキスト" } }
        },
        {
          "name": "outputKey",
          "type": "text",
          "required": true,
          "default": "",
          "ui": { "widget": "bbkey", "label": { "en": "Output Key", "ja": "出力キー" } }
        },
        {
          "name": "outputType",
          "type": "enum",
          "required": false,
          "default": "text",
          "ui": { "widget": "select", "label": { "en": "Output Type", "ja": "出力タイプ" } }
        },
        {
          "name": "outputScope",
          "type": "enum",
          "required": false,
          "default": "run",
          "ui": { "widget": "select", "label": { "en": "Output Scope", "ja": "出力スコープ" } }
        }
      ],
      "impl": { "kind": "builtin", "handler": "misc" },
      "compat": {
        "btAction": "misc",
        "paramMap": {
          "operation": "btPrompt",
          "outputKey": "btOutputKey",
          "outputType": "btOutputType",
          "outputScope": "btOutputScope"
        }
      }
    },
    {
      "type": "wend.core.mediaToFile",
      "label": { "en": "Media → File", "ja": "メディア → ファイル" },
      "category": "transform",
      "icon": "💾",
      "description": { "en": "Saves blackboard media to a temporary file.", "ja": "ブラックボードのメディアを一時ファイルとして保存します。" },
      "ports": {
        "in": [
          { "name": "media", "type": "media" }
        ],
        "out": [
          { "name": "filepath", "type": "filepath", "bbDefault": true }
        ]
      },
      "params": [
        {
          "name": "inputKey",
          "type": "text",
          "required": true,
          "default": "",
          "ui": { "widget": "bbkey", "label": { "en": "Input Key", "ja": "入力キー" } }
        },
        {
          "name": "outputKey",
          "type": "text",
          "required": true,
          "default": "",